Silent Bible,http://j-lyric.net/artist/a0018f8/l01ee78.html,泣かないで 側にいるから受け止めたその手は冷たく愛-ねつ-のない世界に漂いすぎていたんだ抱え過ぎた想いは いつか君の現実-いま-を締め付けていく傷ついた記憶さえ すべて麻痺して変わるはずないと決めつけて変わることを恐れていた運命の連鎖始まる聖なる夜に輝く深紅の星それは君が迷わないようにいつも照らしてる 約束の証どこにいても見守ってる きっと本当の幸せはある?目に見えず、留めておけない不確かなその存在に不安が増してく重なり続ける淋しさ埋める為に演じた嘘作りモノの笑顔にすべて染まった凍り付いた過去を溶かす温もりを教えてくれた君に伝えたいんだ早く僕を連れ出して 遥か遠く闇の手の届かないところへ初めて流れてく優しい涙胸に抱いて「強くなれ」と願うずっと使わなくなってた感情に触れてくれた君にもう逃げないと誓うよ聖なる夜に輝く深紅の星それは君が迷わないようにいつも照らしてる 約束の証どこにいても見守ってる きっと
Sing Forever,http://j-lyric.net/artist/a0018f8/l00baab.html,気がつけば 歌を歌ってた振り返っても 未来を見ても私が私らしくあるために そう、これからも Joy To Sing幼い頃の 写真見て くちずさむその 時々(ときどき)にいつでも あった曲そして 時は流れて伝えたい 言霊(ことば)にメロディーのせて今日もまた 歌う心を込めて届けたいよ宇宙(そら)の果てまで 木魂(こだま)するくらい君が笑顔になれる 力になれば嬉しいよ Joy To Singこの瞬間も 幸せをわかちあおう…導かれてる 感覚は 嘘じゃないそう 私の居場所なら ここにあるきっと 終止符(しゅうしふ)のないこの旅路 私も 音符と共に歩(あゆ)んでる 今日も色褪せず・変わることないMusic誰もがそれに 自分重ねて今日を生きる糧(かて)にする そうさ、いつだって素晴らしい Joy To Sing君の心を 元気づけられるように…誰にも見せない涙 溶かす力持ってる様々な曲たちに 私は 生きる意味 習う気がつけば 歌を歌ってた振り返っても 未来を見ても私が私らしくあるために そう、これからも Joy To Sing君の心を そっと癒(いや)せますように…
Song Communication,http://j-lyric.net/artist/a0018f8/l01e1f2.html,胸につまった喜びの声 聞こえてる?目の前 見えるのは 光る青のSwingめぐりめぐって こんな場所までたどり着いた私のこと 見ていてくれた 君に感謝大切な何かが増えるたび 強くなった だってほら目指す場所は 自分だけの夢じゃないとわかったありのまんまで 笑っていいよOh Oh Shiny Day 抱きしめたい 出会った人一人ずつ心配ないよ 笑っていいよOh Oh Brighter Day カンペキじゃないから みんなが必要だからそばにきてCommunication「だれもわかってくれない」なんて 嘆いてたあの頃の自分に耳打ち「がんばろーよ」 もっとわかってもらえる努力続けたひとが立てる舞台 目指してみる? そうしようよあふれだす涙をぬぐう指 それでいいんだ だってほら僕らは弱い 僕らは弱い 歌ひとつで変われるありのまんまで 笑っていいよOh Oh Shiny Day 左胸のリズムをちゃんと聞いて心配ないよ 笑っていいよOh Oh Brighter Day 大きな声を響かせよう一緒に何度でも歌うCommunicationこの先なにがあってもずっと I stand for youつかまった手は どこまでもやさしくて‥「Wow Wow La Lala Lala La」「Wow Wow La Lala Lala La I stand for you」ありのまんまで 笑っていいよOh Oh Shiny Day 抱きしめたい 出会った人一人ずつ心配ないよ 笑っていいよOh Oh Brighter Day カンペキじゃないから みんなが必要だからそばにきてCommunication
STAND,http://j-lyric.net/artist/a0018f8/l0051e5.html,あの頃の君はいつも 僕の味方だったね倒れかけた時でも 夢を語らせたよね静かに時を過ごして 君は微笑んだからいつまでも続かないと 忘れる様な日々全部受け止め 続けて行くことなどお互いできないと 気付けばぎこちなくなるよね恋人達はいつの日か 離ればなれになるなんて疑うこともしないで 見つめ合ってうなずいてた今頃君のそばには 知らない誰かがいて寄り添うように二人で 歩いているんだよね新しい道を見つけて 僕も歩けるのかな今はまだ進めなくて 空白の様な日々おくびょうになって 迷ってばかりいると君には追いつけず 離れた意味はなくなるよね素敵な想いやりとかで やがて二人に忍び寄る不安と哀しみの影を 打ち消せたならよかったね恋人達はいつまでも 歩いて行けると思ったふざけてそしてじゃれあって 手をつないでた戻ることはできなくて 経験だけが残ること知らずにはしゃいでいた頃 僕だけが懐かしく思う君のそばにいられずに…
STAND UP!,http://j-lyric.net/artist/a0018f8/l03db1f.html,PLAY BALL！サイレンが鳴り響くここからが僕らのスタートライン「正々堂々全力投球」ドラマチック　熱く燃える良き人生-しあい-をSTAND UP！僕らは走り出す　希望をその手に抱えながら「忘れた時は思い出して」夢に満ちたあの日を大人になったら　何になろうかな　宇宙飛行士でも歌手に画家に野球選手　望み通りなんにだってなれるんだそれなのに　今の僕たちはつまんない顔ばっかしてる自分をもっと信じてみよう立ち止まったらそこで全部終わっちゃうから諦めない心を高らかに突き上げて泣いたり笑ったり転んだりもあるけど僕らは行くんだ逃げ出したい　そんな日はいっそ放り出したっていいよそしてまた明日から頑張れたなら一歩ずつ歩いていこうぜMAYBE 僕らはいつまでも子供の頃から夢見ていた「理想の大人」になれる日を未だに追いかけている誰かになることはできないよでも、何かになることはできるのさ大人になったら叶えたかったものがあるんだろう？だから、自分をもっと信じて　ほら怖くたって僕らはもうひとりじゃないから諦めない心を高らかに突き上げて泣いたり笑ったり転んだりもあるけど僕らは行くんだ踏み出せない　そんな時背中をそっと押してくれる沢山の仲間がついているからどんな時もSTAND UP！ さあ　いま何度でも立ち上がり　負けないで　突き進めその先に見えるモノこそがきっと僕たちで勝ち取る story！
STAR ROAD,http://j-lyric.net/artist/a0018f8/l02b294.html,夕虹を照らす太陽が眠る頃ハラリこぼれる涙は 誰を求めてるの?月の揺りかごに想いを詰め込みあなたに会いに行きたい 願いが叶うなら星夜の雨に打たれて 溶けていく氷の檻今すぐ伝えたいんだこの愛よ消えないで共に輝く日までふと口ずさんだ懐かしいメロディ空がどんなに巡っても 変わらずここにある気付かないフリで いつも笑ってた失うことが恐くて 現状(このまま)を望んでた星夜の海に抱かれて 溢れ出す素直な声強がりだけを覚えて言えなかった「おかえり」旅立ちを待ってるあなたを知るたび 夢見てしまうの不確かな未来(あす)への道も 永遠に変えると…星夜の雨に打たれて 募る言葉はただ1つ今すぐ伝えたいんだこの愛よ消えないで共に輝く日まで
STARTING NOW!,http://j-lyric.net/artist/a0018f8/l03b462.html,例えば、1つだけ願いが叶うなら (123Go)世界中巻き込んで笑える恋がしたい (Get ready for a happy time)年表(運命)なんて 空欄だらけ普遍をぶち破れ! (Now's your chance)STARTING NOW! STARTING NOW!!開拓の声明STARTING NOW! STARTING NOW!!気付いているでしょ?全力を知った者だけ 触れられる夢がある例えば、1つだけ誇れるものがあれば世界中覆うほどの涙も拭えるはず (Stand up to the victory)成功への確率 いくら見積もっても空論じゃ意味がない (Give it a shot)JUMPING UP! JUMPING UP!!イチかバチかでもJUMPING UP! JUMPING UP!!情熱は裏切らない食い縛った痛みの分だけ 未来は生まれ変わる神様の試練(気まぐれ)も野次馬(理不尽)な喧騒も躱すヒマはない真っ向勝負なら喜んでお相手しましょうかかってきなさい!!STARTING NOW! STARTING NOW!!開拓の声明STARTING NOW! STARTING NOW!!身体中感じて自分を信じた者だけ 手に出来る夢があるJUMPING UP! JUMPING UP!!JUMPING UP! JUMPING UP!!明日を創り出せるのは 誰でもない、僕らだ
Stay Gold,http://j-lyric.net/artist/a0018f8/l025cfe.html,抱えきれなくて手放した行き場を失った希望想像するたび輝いた未来への期待の向こうFall out遠く目に映る幻想空を仰いで本当に変わると決めた誰かの為声を嗄らし足を止めて叫ぶEver last貴方の為向かい合った全ての涙を拭いここに居るBy your sideあの日見た夢 願い 叶うまで留めていくStay gold色あせないStay gold答えきれなくて飲み込んだ小さく消えてく言葉繰り返す度に昂った波打つ鋭角の音Reliveそっと蘇る 哀傷何度重ねても運命を変えると決めた誰かの為両手伸ばし瞳閉じて祈るNever end貴方の為広がった全ての痛み抱きしめ共に居るBrave my heartあの日見た意志 想い 繋ぐまで振り向かないStay gold過去も今も未来にも絶望を照らす愛になるから心震える奇跡さえも起こせると強く信じて誰かの為声を嗄らし足を止めて叫ぶEver last貴方の為向かい合った全ての涙を拭いここに居るBy your sideあの日見た夢 願い 叶うまで留めていくStay gold色あせないStay gold
STILL IN THE GROOVE,http://j-lyric.net/artist/a0018f8/l00211b.html,急ぐ心を押さえてやっとたくましい生き方できるはずでハイスピードはimitation何も見えなくなったら周り失くして孤独の街へ進む抑えがきかないとたとえば大きな情熱邪魔してあざとく幻想の波に酔わされる美しくても 惑わされても自信はすり抜けるモノ笑える程小さなプライドなんて投げ捨て怖くても 振り返ってみる見つめ直す余裕でしっかり今を受け止めたら助けられた日思い出せる愛情!救いのてだても独りよがりで生きてちゃなすすべも無い飾り過ぎなbed emotion誰も信じられなくてビルの向こうを眺めて羨んだり欲しがってばかりでは遠くに幕が上がってても足元見えないで理想に酔いしれる心がゆれて 横顔見せてsuccess一人占めしてがむしゃらが正義だと見落としてしまうモノは大きくて 戻れなくなるとてもとても重要で贅沢過ぎる宝探し回り道なら見つけられる美しくても 惑わされても自信はすり抜けるモノ笑える程小さなプライドなんて投げ捨て激しさに 怯えたりしてとてもとても危険な贅沢過ぎる宝捜し迷い続けてく still in the groove
STORIES,http://j-lyric.net/artist/a0018f8/l01c714.html,悔し涙をにじませた　あの日の泣き顔さえ今は誰より強くなるための　旅の途中を描いたStoryで戦い続けてきた日々を　決して忘れないよいつか記憶がその輝き　さらってしまっても遥か遥か彼方へ　目指す夢があるならこわくない行こう　走り出そう　果てしなき道へと蒼い空を吸い込み　今　無限の風になるよ軌跡を越えて　明日の向こうへひとり孤独に震えてた　あの日はそうただひたすらに痛みに耐えることだけで　精一杯になって見えてなかった見守ってくれる優しさに　気づいたその瞬間言葉にならない感情が　溢れ出してきたよ誰もひとりきりじゃない　つながりあい生きてくだから寂しくて苦しくても　挫けたりしないで強く大地踏みしめ　今　光を身にまとうよ奇跡を越えて　ゴールの向こうへ遥か遥か彼方へ　目指す夢があるならこわくない行こう　走り出そう　果てしなき道へと蒼い空を吸い込み　今　無限の風になるよ軌跡を越えて　明日の向こうへ
Summer Sweet,http://j-lyric.net/artist/a0018f8/l00f45c.html,それはチョッと危険な　Summer Sweet...Moon Light　車止めた埠頭　二人きりOpen Car　潮風の匂いSide Seat　たおして見上げた流星群きみは急に黙って　この手をにぎって　そして…※恋はチョッと危険に恋はチョッと甘めに二人の距離　縮めてゆく※△きみはチョッとあせってわたしチョッとふるえて恋がはじまりだす今年の夏　きみと　Summer Sweet△Sun Rise　空が少しずつ 明けてゆくIn my heart　ずっと好きだった想いが朝日に溶ける朝の海岸線のカーブまがるチョッと向こうに二人の空　あふれてゆく胸がチョッと痛くて胸にもっと響いて恋が走り出すよ今年の夏　二人で　Summer Sweet(※くり返し)(△くり返し)恋はチョッと危険に恋はチョッと甘めに二人はじまりだす今年の夏　きみと　Summer Sweet
SUPER GENERATION,http://j-lyric.net/artist/a0018f8/l00a6d4.html,茜に染まる風の素顔に声を潤ませる完璧‐理想‐ばかり求めてた 不安ごまかすように決め事だらけの 嘘つきな日々「君ノ ココロ ドコニ アルノ?」1番大切なモノ探しに行こう Get Dream…!星の船に乗り強く漕ぎ出そう 輝く雲を抜け果てしなく続く僕らの夢の海ありのままの姿で華麗に踊る旅のSTAGE裸足で空を翔回るような 少し大胆でとびっきりのスタイルで 勝負賭けていいんじゃない?誰かの為の『普通』の檻(カゴ)に「君ノ エガオ ホンモノ ナノ?」はっきり答えるよ「もう、着飾ったりはしない」閃光(ひかり)より速く 虹の旗広げ迷わず突き進む最高の未来(あす)は そう神様だってきっと創造‐想像‐できない 自由の舵はこの手にあるよ堪えきれずに溢れた涙「がんばったね」って受け止めようこれから自分のコト「好きだ」って言えるから I believe...星の船に乗り現状(いま)を飛び出そう 輝く月さえも越えて果てしなく続く僕らの夢の海もっとずっと遠くヘ大きく息を扱い込んだら 新しいコト始まってく希望の道に終わりはないよ
supersonic girl,http://j-lyric.net/artist/a0018f8/l003dfc.html,迷うことはない 自分の気持ち従うだけこんなに震える 寝ても覚めても愛しすぎるもし天使が出払っててもいますぐ伝えたいよsupersonic 一途な波動でsupersonic もう止まれないsupersonic その気のするまでsupersonic 恋はいつも叶うため現れる愛のつらさの ひとつやふたつ知ってるけどまた新しい 熱い涙を流してみたいもし悪魔が邪魔をしても自力で振り払うよ※supersonic 情熱の波動supersonic 連続的にsupersonic 空回りしてもsupersonic 胸はいつもときめきでうずめたい※supersonic 一途な波動でsupersonic もう止まれないsupersonic その気のするまでsupersonic 突き刺さるまで(※くり返し)
SUPER☆MAN,http://j-lyric.net/artist/a0018f8/l0384be.html,OhYes！ Superman！Let's go Superman！(Su×4 Superman！)Superman　君は気づいているかい？秘めたチカラにうずく鼓動自分自身　信じてゆこう Doing now！Superman　扉をみつけたのかい？カギは胸のポケットの中歩き出せば　輝く世界 Only oneSuperman…Who is it？Superman…Who is it？Superman…Let's be a “SUPERMAN”OhYes！ Superman！　立ち上がれいま猛烈なPower　感じる心みなぎるEnergy　もう誰にも止められない(Su×4 Superman！)Let's go Superman　その手を取ればSo love and dreams　そこはPeaceful world君のガッツで呼び覚ますBe a SupermanSuperman…Who is it？Superman…Who is it？Superman…Yes I am “SUPERMAN”OhYes！ Superman！Let's go Superman！(Su×4 Superman！)Superman　涙をみつけたのかい？勇気を出せば君だって“SUPERMAN”大切なあの子の笑顔を Make up！Superman…Who is it？Superman…Who is it？Superman…Let's be a “SUPERMAN”OhYes！ Superman！　その一声が猛烈なMagic　作り出すのさみなぎるEnergy　もう誰にも止められない(Su×4 Superman！)Let's go Superman　繋ぎ合う手はSo love and dreams　描くPeaceful world君の勇気が呼び覚ますBe a SupermanSuperman…Yes I am “SUPERMAN”OhYes！ Superman！　立ち上がれいま猛烈なPower　感じる心みなぎるEnergy　もう誰にも止められない(Su×4 Superman！)Let's go Superman　その手を取ればSo love and dreams　そこはPeaceful world君のガッツで呼び覚ますBe a SupermanSuperman…Who is it？Superman…Who is it？Superman…Yes I am “SUPERMAN”OhYes！ Superman！(I am Superman)Let's go Superman！(OhYes！ Superman！ )(Su×4 Superman！)
Synchrogazer,http://j-lyric.net/artist/a0018f8/l027592.html,Listen to my song...僕の声は聴こえていますか?please tell me...答えのない虚構の空目指しfly far away言葉じゃ足りないから 僕のすべて受け止めて制御出来ない…したくないよ初めて知る感覚君に歌うよ 永遠の始まりを「だから笑って…」誰よりも熱く 誰よりも強く 抱き締めるよ震える心 揺さぶればいい何かが動き出す僕等きっと、生まれた日から出会える日をずっと探してたんだ風の鳴く夜は思い出して共に奏でた軌跡 天に舞うよ僕の想いは届いていますか?true or false触れ合うたび もどかしさが募るcrying more cryingいつも避けてばかりいた 明日を見失いそうで傷付けないように 傷付かないように嘘だけが増えていく「だけど笑って…」痛いくらいに 苦しい程に そう…愛しいから求める気持ち抑えきれない自分が怖かったやっと、体中巡る本能のRHYTHMに気付いたんだもう二度と君を離さないよ幾つもの昨日がね、未来を照らすこの身朽ち果てても伝えたいものがある響け 生命(いのち)の絶唱(うた)彼方 羽ばたいて「だから笑って…」誰よりも熱く 誰よりも強く 抱き締めたい震える心 揺さぶればいい何かが動き出す僕等きっと、生まれた日から出会える日をずっと探してたんだ風の鳴く夜は思い出して共に紡いだ奇跡 天を描くよ
Take a Chance,http://j-lyric.net/artist/a0018f8/l00baa4.html,(Take a chance)(One more chance)新しい風が吹いた夜明けを覚えているでしょう目の前のものが全てリアルに感じたこと鳴り響くシグナルを消さないで虚像の沈黙に明日を明け渡す理由はいらない広いこの空にフレームは初めから無い君が振り向けば 放射線の路が見える夢はいくつでも その腕に抱えていける君の引力が空を彩るから(Take a chance)(One more chance)わからなくなる朝には少しだけ瞳を閉じて揺れ続けている街を上手に泳ぎ切れるその手にあるギフトが相応しいしなやかな足取りその先に見える自分さえ超えて青い衝動がリミットを振り切っていく君が望むなら 何度でも扉は開く鼓動解き放つその声が光になって路を示すから どうか信じていて答えを急ぐノイズをくぐり抜けて君の名を呼び続けるからTake a star散りばめたその想い駆け抜けていくOne more chanceこの空は終わらない夢を待ってるTake a star本当の朝がほら やってくるからOne more chance手を取っていつかひとつになる夢はいくつでも その腕に抱えていける君の引力が空を彩るから(Take a chance)(One more chance)
Take a shot,http://j-lyric.net/artist/a0018f8/l00a6d5.html,淀んだ空気 抜け出せるように 教えてくれたよね込み上げてくる 静かな願い 自分を取り戻そう仰いだ空の果て 君の眼差し思いやりの雨に 打たれて消えてくlet me down 止まらないshake up はじめて 気付いて 委ねて take a shot見渡したら君がいてためらう事なく戦う意味は鮮やかに咲き誇れるように弱い心と 向き合うことどこへ向いても どこへ向かって 歩けばいいなんて自分の道も 決められなくて たたずむ僕がいた遥かなる未来に 希望絶やさず雲に隠れていた 途切れない勇気I have drive 呼び澄ませtake off 震えて 目覚めて 尋ねて pave the way迷わないで君と行くどうして戸惑い続けてきたの?晴れやかに勝ち誇れるように無数の願い 掴みとろう強く優しく 翼に風を...shake up はじめて 気付いて 委ねて take a shot見渡したら君がいてためらう事なく戦う限り失うものなどない震えて 目覚めて 尋ねて pave the way迷わないで君と行くどうして戸惑い続けてきたの?晴れやかに勝ち誇れるように無数の願い 掴みとろう
Tears' Night,http://j-lyric.net/artist/a0018f8/l00a362.html,強く強く 抱きしめた冬の夜伝えあった 秘めたる思いあなたの声 聞いてたらなんだか急に 苦しくて震える声 それはただ寒さのせいじゃないよ「ねぇ、どこにいる?」もう隠せない 愛を求めた今夜 もしも 会いにきてくれるなら心 すべて みせてもいいよどうか どうか 抱きしめてください祈るように閉じた まぶた あつくあなたの名をくり返した Tears' Nightあの日のこと 覚えてる?誰もいない 帰り道薬指をつないでたどんな顔をしてたの･・?「ねぇ、教えてよ」駆け引きなど 今はできない私だけの あなたをもっと知りたい心 すべて みせてほしいよどうか どうか うなずいてください涙こぼれないように 見上げた闇の向こう 輝き出す StarlightTime 時をとめてWish 願うことはMiss you 切なさを救い出して 喜びへとFly 一緒に行こう離れないで 心をちゃんとつないであなただけの 私でいたいずっとずっと たいせつにするから白い息が溶けて 溶けて重なり合うくちづけ強く強く 抱きしめた冬の夜伝えあった たしかな思いどうか ずっと そばにいて祈るように閉じた まぶた あつくあなたの名をくり返した Tears' Night
TESTAMENT,http://j-lyric.net/artist/a0018f8/l0415e2.html,飛び立て、声を翳して...握り締めたその手にある夢は運命-レール-さえ抉じ開けるほど疼くよ (激しく)沸き上がる感情に身を任せ正義が求める答え、出せるのか? (僕らは)暗闇-沈黙-を切り裂いていく稲妻のように高らかに信じた愛を貫き進もう命燃え尽きて倒れても 終わることのない歌が嘆きで霞む未来照らし出す例え、世界から見放され 寂寥の矢射られても胸に灯る情熱-炎-は消せないから君に響け何度でも Love of all energy抱き締めたその腕にある希望細胞が覚悟へと記していく (刻むよ)僕たちは産まれ落ちる前から言葉にできない想いを旋律に (描いて)何かに焦がれるたび渦巻いて行く明暗-デュエット-本能が示す鼓動に委ねよう君が望むなら天地さえ覆すほど叫ぼう追うほどに根付く迷い打ち壊す誰かの願いが この空を曇らせようとしても君と紡ぐ明日が闇を穿つ喧騒に囚われた概念-ベール-を剥ぎ取り奇跡より特別な笑顔を守りたい命燃え尽きて倒れても 終わることのない歌が嘆きで霞む未来照らし出す例え、世界から見放され 砕かれても胸に灯る情熱-炎-は消せないから君に響け何度でも Love of all energy飛び立て、声を翳して...
