76th Star,http://j-lyric.net/artist/a0018f8/l00f44f.html,星くずたちよ聞いて　私、約束するよ世界中の誰より　輝いてみせるってアナタがアタシの　総てを変えたわ探しつづけてた　心のカギ　扉をひらけば※I'm 76th No.1 STARすい星のようにキラめくよ　エンジェルハートはNo.1 STAR夢みているのよ※暗い銀河さまよい　やっと気づいたのトランジスタなBodyも　みがけば光りだすって仔猫がどれほど　Sexyかってこと今夜こそアナタに　たっぷりと教えてあげるよ△I'm 76th No.1 STAR世紀に一度舞いおりる　エンジェルハートはNo.1 STARみつめてほしいの△もしもブルーな時は　ホラ、想いだしてごらん頬笑みは永遠のチャンスの呪文だって未来を指さす　星座をみつめて信じてる何かを　つぶやいたら　明日が見えるよI'm 76th No.1 STARすい星のようにキラめくよ　エンジェルハートはNo.1 STAR夢にとどくまで(△くり返し)(※くり返し)
7COLORS,http://j-lyric.net/artist/a0018f8/l025cfd.html,冴えない顔してどうしたんだい?探している答えなんて とっくに知っていたよ微かに残った熱を胸に傍観者になろうとする恐がりを捨てるよ情熱の彼方 虹を描いたらギュッと雨のち晴れの空 抱きしめるよナナイロに光るDay Dream覚めない夢を見る何度でも僕はここから未来へと駆け出すよ 真っ直ぐに弱気な心が塞ぐ今も君の声が響けばまた 歩いて行けるから真っ白な地図を指でなぞったらきっと風を身にまとって 旅に出るよナナイロに光るDay Dream瞳を開けてみる思うより青い空へと手を伸ばし抱き寄せる この瞬間(とき)を痛み知った胸に咲く 枯れないままの夢はじまりの気持ち忘れないでね 明日が見えるはず…ナナイロに光るDay Dream覚めない夢をずっと何度でも僕はここから未来へと駆け出すよ いつだってナナイロに光るDay Dream覚めない夢を見る何度でも僕はここから未来へと駆け出すよ 真っ直ぐに駆け出すよ 真っ直ぐに
7月7日,http://j-lyric.net/artist/a0018f8/l021691.html,「おやすみ」と髪を撫で 白い月が昇るよ今日はどれだけの「本当」に出会えたかな…聴こえるよ 風の歌が僕の半分の世界 優しく彩っていく飛び立つ日待ってる大切だから言えなくなること大好きだから隠してしまうことがね、あるんだどうして…？流れ星-星の涙-僕に降り注ぐよずっと忘れぬように声に出して伝えたい変わることない この気持ちだけ『君といると 幸せなんだ』これからも傍にいるよ覚えてる？奇跡の話君は笑って言ったね大袈裟なことじゃないよ「ココにいることがそう」当たり前過ぎて言えなくなってた追いかけ過ぎて見えなくなってた僕に教えてくれたね地球-命の星-この瞬間(とき)もどこかで生まれてく物語-ストーリー-声に出して伝えたい揺るぐことない この気持ちだけ『君がとても愛おしいです』今ならきっと素直になれる見上げてごらん この空は１つだけ一緒に新しい名前を付けよう流れ星-星の涙-僕に降り注ぐよずっと忘れぬように声に出して伝えたい変わることない この気持ちだけ『君といると 幸せなんだ』これからも傍にいるよいつも ごめん。いつも ありがとう。
Abilities,http://j-lyric.net/artist/a0018f8/l00a35c.html,運命線がどうとか 本日ダメだよ!だとか占い番組じゃ いい加減な事ばかり言うけどちっぽけな うつりゆく理想を求めたいの 大きなカガミを見つめ自分流で行こうそれなりの生き方でも良いよ! なんて人に任せてちゃ ズルイんじゃない?ゼロからはじめてみれば良い計り知れない才能をいかしてプラスにしよう目覚ましを合わせて 旱起きして即!出かけ通勤電車では もまれて押しつぶされてしまうよあきらめて 適当な恩恵求めてたら いつまでたっても今と変わらないよヤメテリアリティーの中から逃げ出そうね形を変えれば スゴイんじゃない?座ってるばかりじゃ意味がない突き抜けてる才能は誰しも秘められてるのおとなしいように見せたり どうにかして時にはロマンス楽しんで生命線とかも長くして明日吹く風を押し出そうよ今日から動けるテンションは計り知れない才能をいかしてプラスになれる
ACROSS,http://j-lyric.net/artist/a0018f8/l0415e1.html,優しき声が 届かぬような荒地の中 一人彷徨ってる目を逸らすような 景色の中で頼れるのは 明日への地図だけ君と願う かすかな希望守るためなら怖くても眠る大地を走り抜ける刻め、この胸にある確かなる想いよ信じ抜く力を糧に闇を切り裂いてゆける響け、遠い彼方でも未来への誓いよいつか祈りは重なって光へ 辿り着けるよ記憶の中で 蘇る影浮かぶ君の笑顔 涙が滲むよ正解(こたえ)のない日々 うずくまっても迷いの先に 真実が見えるはず行き場のない 絶望でも絆は 誰も裏切らないだから強く走り出せる描け、消えることのない愛に満ちた世界を命ある限り僕等は自由を求めてゆける掴め、偽ることのない心で居られる場所飽くなき意志を 貫いてその手で 灯(あかし)を 創ろう悲しみの歌が聴こえてくるよ争いは絶えず嘆きを繰り返しても明けない夜はないから痛みを越え立ち上がって行け輝く方へ…放て、この胸にある確かなる想いよ信じ抜く力を盾に闇を切り裂いてゆける響け、遠い彼方でも未来への誓いよいつか祈りは重なって光へ 辿り着けるよ
ALONE ARROWS,http://j-lyric.net/artist/a0018f8/l03db21.html,両手を広げて抱きしめるようすべての夢を　叶えるイメージ誰かの理想やプロパガンダ踊らぬように　今を刻むだけ煌めきから目を逸らしては　絶望　飼い慣らしてたそれでも逃れられない　寂しさの青Alone 弾かれた　孤独の矢が流れていく　星のように　闇を切り裂いてArrows 聞こえるよ　同じ痛みいつか出会う　君を探し　明日(あす)を取り戻すために群れから離れた羊のよう冷めた視点で　世界を見つめて慣れ合う煩わしさ避けては強がることを　強さと信じた甘さなんて重々知ってる　その分多く望まずだけど気付き始めてる　焦燥の限界―リミット―Alone 放たれた　孤独の矢は分け合うことに　触れ合うことに　きっと憧れてArrows あの頃と　同じ恐れ逃げ出さずに　負のスパイラル　ここで終わらせるために傷はとっくに癒えてる　新たなフェーズ待ってる青ざめた頬 朝日に染め　昨日は破り捨ててなぜ　溶け出した涙ひとつ閉じ込めてた　願いにまた　光灯す時Arrows 飛び回れ　果てなき空心求めるままに　傷ついて答えを　手にするまで
Angel Blossom,http://j-lyric.net/artist/a0018f8/l0359b8.html,出会いはmutate…「ほらね」弾む声で君が微笑んだ目眩起こしそうな始まり 突然のMAGIC説明不要のガイダンス 不思議な引力で惹かれ合う瞳 心はもう無重力今、その手に触れたら開いていく 聞こえる命運だって きっと待ちきれず動き出すよ羽撃け 不屈の夢の彼方までありきたりのcodeは壊して誰も見たことない世界君となら行けるよ感じるままに伝えたいんだ すべてを挑発的な未来 鼻を擽って本能が目覚める予感 偶然のGIMMICK過去さえ塗り替えそうな 不器用な太陽が照らし出す光 僕の胸躍らせるほら、置き去りにしてた幸せへのlyricやっと迷わず抱き締められる輝け 夜空に虹を架けるほど誰も知らない君を知りたいどんな理論も通じないこの想い信じて新しい時間(とき)を紡ぎたいよ 一緒に1人きり 当てもなく漂いもがいてた明日が見えず溢れた涙 君が浚っていくありのままを教えてくれた羽撃け 不屈の夢の彼方までありきたりのcodeは壊して誰も見たことない世界君となら行けるよ感じるままに伝えたいんだいつでも 答えならtruth
Astrogation,http://j-lyric.net/artist/a0018f8/l00c342.html,加速したEmotionが 胸を何故か締めつける普通になれないよ 君を描きすぎて笑顔が眩しいから アンドロメダの宝石みたいいつも笑うけれど 僕は真剣だよなんて君の存在は AI(エーアイ)を愛にコンバートするの?無限のカオスも悪くない All right! 明日(あす)を越えて感情がハジける アダムとイヴの軌道を追うReady Go to star heaven 恋だと地図が示すよシンクロしたい でも届かない君との距離ワープしたい夢を語るには 宇宙じゃなんか狭すぎるからShining love ＆ Galaxy 「大好き」が溢れてるんだ上手く言えないけど僕についてきて空を教えてあげるよもしも今この瞬間 テレポートが出来るのならば銀河の記憶を 君と旅したいよロジックや方程式や 重力なんてもういらなくて二人の引力があれば All right! 時を翔けようShooting star ＆ Crescent moon静かなこの海を越えよう生命(せいめい)の起源からこの出会いは決まっていたんだ感情がハジける アダムとイヴの軌道を追うReady Go to star heaven 恋だと地図が示すよシンクロしたい でも届かない君との距離ワープしたい林檎が堕ちた日から 僕らは遥か愛情に出会いShining love ＆ Galaxy 「大好き」が溢れてるんだ僕のすべてになってほしい 君だけに世界を全部あげよう
BE READY!,http://j-lyric.net/artist/a0018f8/l00f457.html,見慣れた街捨てて　飛び出したあの日優柔不断なら　出来なかったはず生意気なポーズで　背伸びしたりして語り明かしたのも　意味を持っていた思い出せたのは　瞳にうつった感動的な夢　be ready振り返れば熱くなる　負けられないね目覚めた人はいつでも　気持ち込めた生き方で道なき道を行く　歪んだ世間気にしないひとつひとつを　深くとらえる事などないさあこがれだけ抱いて　幻集めて前途多難だよと　言われてしまえば小さな悲劇でも　切なさ膨らみ張り詰めた空気で　全て消えそうな今は悩んでも　鏡にうつした背中にはあの夢　be ready浮かんでは消えてしまう忘れていたねナキゴト言わなくていい　思い通り生きる道自分で決めた事　少しずつ加速すれば凍えた指も　春に溶けると願ってみようよあの時まで　何もなかった目覚めた人はいつでも　気持ち込めた生き方で道なき道を行く　歪んだ世間気にしないひとつひとつを　深くとらえる事などないさ
"Birdie, birdie",http://j-lyric.net/artist/a0018f8/l003df0.html,ふたつの瞳に映っている言葉に出来ない悲しみ溢れ出すのを待ってるBirdieついばんでBirdie涙の粒自由な大空に心を連れ出してまぶたを閉じれば響いてくる昼は昼に 夜は夜に静けさと平和伝えて※Birdieあの空はBirdieあなたの家私の窓辺にも愛を歌いに来て※(※くり返し)
Birth of Legend,http://j-lyric.net/artist/a0018f8/l048c91.html,Wow Wow…いまだ此処にないものを生み出そうとするのなら経験則もプライドも 捨てることからかつては抱きしめていた何かを取り戻すならゼロから創る倍以上 力が必要Ah 崩壊を見つめて嘆くより その手で高らかに鳴らせ 希望の鐘を始まりの鼓動 Can you feel風化した価値を 剥がし生まれたての太陽 吸い込んだら負ける気なんて しないはず新たなる自分 Set you freeさらなる進化を目指し歩いて行く この日々こそ彼方の歴史 いまBirth of LegendWow Wow…神々のシナリオなら淘汰じゃなく 自浄作用抗う僕らはいつも試されているねAh 革新のトビラはそれぞれの想いが 迷いを貫き舞い上がる空に…誰かが創り上げた 未来を今生きてるのなら そう 僕らの夢も未来へ遺そう始まりの鼓動 Can you feel凍てついた胸を 焦がし光が射す 空へと誘(いざな)うから僕らはまた 旅立つまだ見えなくても Hold the dream僕らは変わり続けるこの世界を 共に進もう彼方の歴史 いまBirth of LegendWow Wow…
BLACK DIAMOND,http://j-lyric.net/artist/a0018f8/l00eb95.html,一番のねがいごと 教えて―あなたのほしいもの―ボリューム振り切れるほど強く大きな声で 叫んでみて太陽が目覚めぬうちに始めよう 世界は光につきまとう影と踊るそう 君の手をとってさぁ 何が欲しいの? 何を求めるの?集めた輝き その手のひらにすべてすくいとる 汚れた夜空に黒いダイヤモンド ブラックダイヤモンド震える手で 祈りを捧げて―アナタノホシイモノ―意思のない人形のようじゃね涙だって流せない傷ついても 嘘だらけでも決して 屈しない本物だけが 輝いている見えない力に逆らってさぁ 何を歌うの? 何を信じるの?迷っているだけじゃ ガラクタになるすべてふりきって 歪んだ夜空に黒いダイヤモンド ブラックダイヤモンドさぁ 何が欲しいの? 何を求めるの?集めた輝き その手のひらにすべてすくいとる ねじれる夜空に黒いダイヤモンド ブラックダイヤモンド
BLUE,http://j-lyric.net/artist/a0018f8/l03333f.html,君の手に触れてるような温かい光 この星を照らしていくこんなにも美しい空側にあること 忘れそうになっていたよ朝日が射せば目覚める当たり前に感じる景色の中に奇跡が眠っていたんだ誰もが限りある時に生まれて限りない希望を探し続けてる恐れることも 痛みを知ることも愛という未来に繋がっていくとめどなく押し寄せる日々に飲まれぬように ただ走るしかなくて本当に大切なもの気付いているのに 見失いそうになっていたよ言葉を超えた想いが蒼い海を巡って 夢を翼に変えてく煌めく航路(たびじ)へきっと何かが始まる瞬間は輝く笑顔と共にあるだろう涙で滲んだ闇に迷っても愛が明日への道を切り開いていく誰かのために生きる喜び初めて君が教えてくれた小さな灯が惹かれ合い 木霊するように世界を彩っていく誰もが限りある時に生まれて限りない希望を探し続けてる恐れることも 痛みを知ることも愛という未来に繋がっていく「いつも君が幸せでありますように・・・」
BRACELET,http://j-lyric.net/artist/a0018f8/l0384bd.html,呼吸するよう自然にあなたはまたLockしてく私が開きかけた　ドアを閉じて君のために、というけど私の何がわかるの？永遠に届かない　言葉もある穏やかな　フリをした　愛情の代償に　ねぇ何を見失う夢見てた硝子の靴が時が過ぎ　つま先から　ひび割れてしまう変わらないあなたのとなり見知らぬ明日(あす)を　探しはじめているもう待てなくて　踏み出そうとして思い出が手に絡まって繋がれている　煌めいてたBRACELET肌に触れる温度とかひとりじゃない現実を手放すことが怖い　夜もあった誰もみな　答えなど　わからずに止めどない　静けさに　焦れてゆく築き上げた砂の城が気まぐれな波にのまれ　瞬間に　消えるどんなに信じてみたって壊れないものはきっと　どこにもない出会った頃の幼いままの私はあなたの記憶にしか　もういないの気怠い横顔はやく　向き直してよ気付いて欲しい…このBRACELET外れる前に夢見てた硝子の靴が時が過ぎ　つま先から　ひび割れてしまう変わらないあなたのとなり見知らぬ明日(あす)を　探しはじめている惰性じゃなくて　夢を見たくて「自由」にまた憧れて振り切りたくて　涙が落ちて離せないのは私でもう待てなくて　踏み出そうとして思い出が手に絡まって繋がれている　煌めいてたBRACELET
Brand New Tops,http://j-lyric.net/artist/a0018f8/l018d28.html,新しい場所へ行こう(心が揺れないうちに)ココは大好きだったけど(それだけじゃダメだ)慣れた明日より 今を超えたいんだ夢に忘れられるまえに Re:starting勇気をくれたキミには(心からのありがとう)涙はまだとっておくよ(泣きそうな顔でも)いつかふさわしい歌を見つけてはじける笑顔に飾る(そのときまで)叶えようとせずしまった夢は(変わらないで)あとで必ず熱をもって 痛みだすの?そんなのイヤ Ready Go Now !!飛びだそうよ こんな時代だからアタシだけが アシタを動かす白か黒か決めるのMyself うまくいくわ愛そう My Dream Top昔の仲間たちにも(しばらく会えてないけど)味方のままでいてくれる(光でつながる)いつかこの声届くその日に遠くで返事を聞かせて(そのときまで)一人じゃないって わかってるから(変わらないで)寂しい､､なんて ゼイタクだねみんな同じ 夜を越え Come to Life !!のばした両手につかんだものは自分だけの 宝物でいいそれぞれに抱く 輝きが幸せだとわかった My Treasure Topがんばろうよ こんな時代だからアタシだけが アシタを動かす白か黒か決めるのMyself うまくいくわ愛そう My Dream Top胸に抱いた 輝き My Treasure Top
BRAVE PHOENIX,http://j-lyric.net/artist/a0018f8/l00a360.html,手と手の温もりが僕を強くする積み重ねた想い空を駆け抜けて風になるこの願いが涙さえ乾かして解き放つ力が剣になり突き抜けるきっと終わりは始まりの唄羽ばたいた鳥の唄戦う意味を見失わないで祈りよ星になれ今は共に燃やした焔を明日への灯火にして震えてもいいからぐっと前を見ようこの胸に小さな勇気と 奇跡を...気づけば傍にいるなんて暖かいのまるで花のようにいつも寄り添って本当の宝物が何なのか気づいたよもう二度と迷わない君の為に僕の為にきっと涙は虹に変わって七色に煌めくでしょう心と心の架け橋になり刹那でもいいからそして大きな翼を広げあの丘の太陽よりとびっきりの顔で無邪気に笑うんだただ空は光を待ってる 飛ぼうよ...やがて僕や君が大人になって夜に泣いててもこのかけがえのない歴史(とき)が未来の地図になるだろうさあ今生まれゆく新たな道をどうか惑わずにほら見上げてごらん地平線から命が息吹くよきっと終わりは始まりの唄羽ばたいた鳥の唄戦う意味を見失わないで祈りよ星になれぎゅっとぎゅっと繋いだ心を絶対に忘れないよ確かな事は今旅立つ僕達が夜明けより輝いている事 笑顔で...振り返らないで 行こうよ...
BRIGHT STREAM,http://j-lyric.net/artist/a0018f8/l02994b.html,"僕の瞳に映る君 何を見つめてるの…?拭えない闇に射し込む一筋の光傷付いた心さえも優しさに変える無垢な輝き すべて解いてく「怖がらないでいつもそばにいるよ」君の声が僕の夜空(そら)こだまする真っ白な羽根は希望―あす―を探して幾つもの過去―よる―を越えていく独り隠した悲しみ抱きしめて流れた涙―星―の数だけきっと強くなれると信じてるよ君がいるから俯かない君の瞳に映る僕 何を想ってる…?初めて知る温もりに不安が襲うよ何度も消えてしまった願いはいつしか""素直""の意味まで消してしまっていた「ここにいたいよ…ずっと一緒にいたい」口にすれば また失うと思っていた真っ直ぐな夢は自由求めて果てない未来を綴ってく止まったままの時計を壊して誰より早く伝えたいんだ真実の扉開いてく僕がいるから守り抜くよ君の笑顔がもっと見たくて気付けば僕も笑っていた当たり前な日々がこんなに愛しいと君が教えてくれた真っ白な羽根は希望―あす―を探して幾つもの過去―よる―を越えていく独り隠した悲しみ抱きしめて流れた涙―星―の数だけきっと強くなれると信じてるよ君がいるから俯かない始まりの場所へと飛んで行こう…"
Brilliant Star,http://j-lyric.net/artist/a0018f8/l003df5.html,泣きたいこと誰でも たくさん持っているの?途切れた声 その先を ごまかしながら生きてる朝もやの中で 人にはぐれ見失いそうな『光』を 時々こうして壊れないように集める月まで行け 暗い道を たどるならその胸に溢れる 幼い輝きover misty ready fairy 闇にかざして描きすぎた 胸のコンプレックス 消せなくて鼓動と言うリズムが 不意に振れたりover misty ready fairyキラメクような夢なら いつか叶うよ...約束事たくさん 頭に詰め込んで自分にさえ 小さなわがまま言えなくなる間違いだらけの道順でもただ前に進めばいいと 教えてくれてねだから振り向かずに行こう時代の果て 遠い道を 選ぶなら自分を好きと言える 自分になってover misty ready fairy それだけでいい焦がれ過ぎて 胸のコントロール できなくて大人になったフリで カカトをあげたover misty ready fairyそれでもきっと光に 近づいている...月まで行け 暗い道を たどるならrainy day sweet and honeyAny day dream and brightover misty ready fairy 闇にかざして描きすぎた 胸のコンプレックス 消せなくてreiny day sweet and fire. Any day hope and courageover misty ready fairy キラメクような夢なら いつか叶うよ...
Bring it on!,http://j-lyric.net/artist/a0018f8/l00f462.html,鳴り止まない夜のvoices君を縛り付ける聞き飽きた言葉遊び(キレイゴト)終わりはないの?「しょうがないよ」そう、誰しも計算高く舌を出すいつからなの?そんな世界　壊してあげましょう無限の罠が仕掛けられたパロットグリーンの羽音見せかけだけの星に決して惑わないで伝えたいことならいつでも此処に用意してあるから迷った時は　この詩(うた)心で叫んで同じ答えばかりでつまらないelite(ドール)たち全て手に入れたくてご主人様(あるじ)待ってる「ボクにはない」逃げていたよ　欲しがる口癖消して眠りについたホントの君放ってあげましょうかりそめの時間に置き忘れた鮮やかな夢の蕾もう二度と離さないで君だけの未来無い物ねだりばかりしてたはがゆい日々にさよなら君にしかできないperformance(コト)沢山あるはずもし君が孤独に嘆いて瞳を閉ざしたとしても僕が傍にいるから　怖がらないで伝えたい音ならいつでも此処に用意してあるから迷った時は　この詩(うた)心で奏でて
Brlng it on!,http://j-lyric.net/artist/a0018f8/l00baa1.html,鳴り止まない夜のvoices君を縛り付ける聞き飽きた言葉遊び-キレイゴト-終わりはないの?「しょうがないよ」そう、誰しも計算高く舌を出すいつからなの?そんな世界 壊してあげましょう無限の罠が仕掛けられたパロットグリーンの羽音見せかけだけの星に決して惑わないで伝えたいことならいつでも此処に用意してあるから迷った時は この詩-うた-心で叫んで同じ答えばかりでつまらないelite-ドール-たち全て手に入れたくてご主人様-あるじ-待ってる「ボクにはない」逃げていたよ 欲しがる口癖消して眠りについたホントの君放ってあげましょうかりそめの時間に置き忘れた鮮やかな夢の蕾もう二度と離さないで君だけの未来無い物ねだりばかりしてたはがゆい日々にさよなら君にしかできないperformance-コト-沢山あるはずもし君が孤独に嘆いて瞳を閉ざしたとしても僕が傍にいるから 怖がらないで伝えたい音ならいつでも此処に用意してあるから迷った時は この詩-うた-心で奏でて
