アルビレオ,http://j-lyric.net/artist/a0018f8/l021692.html,誰が為に歌う？軋む小夜曲(セレナーデ)行き場もなく彷徨い 涙を流すよ永遠を知ったあの日にはもう戻れない蜃気楼に吸い込まれてく螺旋の夜の調べ 星屑が踊る灼熱-ルビー-の口づけを僕だけに下さい夢の中に隠した小さな幻-温もり-を消さないで誰が為に願う？美しき円舞曲(ワルツ)あぁ…手を伸ばすほど遠離って行く奇妙に微笑む赤銅の月どこへ向かうのですか…？答えなどない君を想う程に愛に蝕まれ痛みさえ確かな幸せに変わる螺旋の夜の調べ 星屑が踊る灼熱-ルビー-の口づけを僕だけに下さい夢の中に隠した小さな幻-温もり-を消さないで
アンティフォーナ,http://j-lyric.net/artist/a0018f8/l03b461.html,語ることを止めた 物語の行方は暴くための鍵を 失くしてしまったまま残酷な真実 ∞ 優しく美しい嘘幾重に深く刻みあい織り成す闇の前奏曲(prelude) 奏でる恋い焦がれ 求め合いながら互いに傷つけ合うその棘は 愛の為か報われぬ哀しみの為か翳し合う 正義たちが舞う答えなき旋律が導くその結末を悲劇とは呼ばせない秘めた意志(おもい)抱いて 何を夢見てるのか犠牲と引き換えに 罪を贖えるのか始まりは遠い日数奇なる筋書きで無垢な命は 絶望に絡め捕られて何もできないまま…音を立て 崩れ墜ちてゆくこの世界の破片をひとひらも零さぬようずっと独り堪えていたの錯誤する伏線が散らす破滅への残響が鳴り止むことはなくても嘆くだけじゃ終われない切なる願い凍り果てて 固く閉ざされながらもやがて目醒める時を待ってるそう、信じている恋い焦がれ 求め合いながら互いに傷つけ合うその棘は 愛の為か報われぬ哀しみの為か翳し合う 正義たちが舞う答えなき旋律が導くその結末を悲劇とは呼ばせない
アンティークナハトムジーク,http://j-lyric.net/artist/a0018f8/l031182.html,運命(Fatale) 赤い口唇 あなたを呼ぶの途切れた時間 知りもせずMoonlight Moonlightみずうみ咲く 月を見てたゆらゆら心が波打つUn-deux-trois Un-deux-trois誰もいないLarme Je t'aime Larme Je t'aime夜更けに回るオルゴール忘れられた恋のPrima donna消え行く面影と 踊り続け風が啼くような 儚い歌声 今あなたを探している 悲しい旋律 Nachtmusikもし 薔薇になれたら 香り放って振り向かせたい もう一度Sunlight Sunlightあなたがいた 夏の欠片キラキラ記憶で眩しいおとぎ話信じたPrima donna止まることも出来ず 踊り続け初めて愛し 初めて愛されたの ただ運命の人だった 止まない憶いのNachtmusikUn-deux-trois Un-deux-trois誰もいないLarme Je t'aime Larme Je t'aime永遠 回るオルゴール誰か 止めて忘れられた恋のPrima donna消え行く面影と 踊り続け果たされぬ約束を待ってる ずっとあなたを探している悲しい旋律 Nachtmusik
アンビバレンス,http://j-lyric.net/artist/a0018f8/l0384b6.html,窓辺に映る夕闇あなたの肩にもたれて優しい嘘ならば　もういらない今すぐドア開けて答えを出せないまま　季節は巡るのたとえばこの地球(ほし)の片隅で二人がずっと暮らせるのなら何もいらないまるで子どもみたいに泣きじゃくる私をただ抱き寄せたその手には二度と触れられないとわかっている good-byeおざなりな台詞並べ曖昧に時が過ぎる正しいことなんて　もうわからない今更遅すぎるけどため息消せないまま　夜空を見上げたたとえばこの地球(ほし)で巡り逢えたことはきっと偶然じゃない　そう信じてるだから後悔しないよ微笑んだあなたをまだ忘れられず愛しているいつか思い出に変わる日は来る？教えてどうか振り向かないで　見送らせてここからたとえばこの地球(ほし)の片隅で二人がずっと暮らせるのなら何もいらないまるで子どもみたいに泣きじゃくる私をただ抱き寄せたその手には二度と触れられないとわかっている good-bye
アヴァロンの王冠,http://j-lyric.net/artist/a0018f8/l02b28a.html,人がまだ天使だった頃から謳われた銀世界に降り立つメサイア何万年の愛のリライト 散らないで手をすり抜ける 生命(いのち)のテイルそれでも何かが 胸を打つよ希望は暖かく 一直線に遠く遠く 沸き立つ光へ…宣誓をさあ立つのだGuardian 願う夢があるのだから反逆の先…見えるか? 栄光のアヴァロン王冠はいらない 小さな花があればいい生まれよ新たに 薫り高く咲き誇れゼロ距離へと近づくほど何故か運命は反比例してサヨナラを待つ微笑み返す眼差しの一瞬が一生分ものキスのように銀河分の2を僕らは出会い何度目の恋して伝承になる?さあこの物語の結末を…まっすぐ見よ絶世に光る七色の虹の丘で両手いっぱいに広げて風にならないか?王冠はいらない 君さえいてくれるなら指先伝うよ 何より強い絆だから…すべてを捧ごう愛とは?自由とは?答えとは?終わり無き旅よ 嗚呼…往こう遥か天へさあ立つのだGuardian 守る夢があるのだから反逆の先…見えるか? 栄光のアヴァロン王冠はいらない 誇りさえあればいい原初に還ろう 英雄の詩永久にあれ
笑顔の行方,http://j-lyric.net/artist/a0018f8/l030292.html,卒業アルバムの　最初の春のページ無邪気に笑う私がいる…-思いきり抱きしめたい　この腕を伸ばして-髪を上手に編めるようになって　マニキュアだってうまく塗れるわもうあの頃の私じゃない　同じ笑顔はできなくても手を伸ばす勇気に換えた　ベクトルの行方はあなただけに向かっている　まっすぐにたった一言がいつも言えなくて　泣いてばかりの私を消した何も失くしてなどいない　同じ笑顔はできなくてもきっと言える　きっと届く会いたい夜も　逢えない夜も　超えて思いきり抱きしめたい　この腕を伸ばしてあなただけが握っている　この笑顔の行方を-今ならもっと　イマナラモット素直に笑える　ワラエル最初の春に　イマナラモット負けないくらい　マケナイクライニ
えがおは君のためにある,http://j-lyric.net/artist/a0018f8/l04464b.html,"君に出会うためここまできたんだしまなみの風に誘われてみんなの夢を受けたからだに輝くオレンジの太陽空を見上げて明日を想うとき自分を信じられずにうつむいた知らず流した涙のその先に答えをみつけた勇気だして怖がらずに踏み出そう「できる」そう思うことが何よりも大切背中押すよ""がんばれ""の声が味方にえがおは君のためにある眩しい朝焼け 高鳴るよ鼓動さえずる鳥たち羽ばたいて靴ひも結び深呼吸した素晴らしい今日という晴れの日瞳を閉じてふるさと想うときみんなの明るい顔が浮かんだよ決して一人じゃないと感じられたら強さに変わった""希望""胸にどこまでも走って行こう夢を失くさないことが何よりも大切花が咲くよ 瀬戸内の海が教える未来は君のなかにある海の香る風はやさしく吹くよみんなの髪をなでるように そっと誰の心にもいつか虹が架かるゴールがあるから勇気だして怖がらずに踏み出そう「できる」そう思うことが何よりも大切背中押すよ""がんばれ""の声が味方にえがおは君のためにある"
エゴアイディール,http://j-lyric.net/artist/a0018f8/l0384b7.html,言いたいこと言えなくって書き殴って　破り捨てていつになれば手放せるの　傷だらけノート何も聞こえないフリで笑顔振りまいて　何処へ行くの？高性能なイヤフォンがあればねえ、僕の声カタチに出来るかな響け　止めどなく溢れる流星のようにひたすらに不規則で　カッコ悪い僕の宇宙―ソラ―だけどどこにもないメロディーなら届けられるよ笑われてもいいから　全力で歌いたい理想ばかり妄想して自分自身　質問攻め参っちゃうよ　雁字搦め気付けばまた、ポーズ向けられた視線の熱に歯止めきかなくて戸惑ってる毎日溜まっていく選択モノたち根こそぎ綺麗に片付けたい叫べ　迷いの孤影　吹き消してしまうほど今更に不器用で　カッコ付けた僕の心音―オト―だけどとてつもない夢なら用意してあるから前だけを見つめて　この一歩を信じたいよ高く遠く飛ぶことそればかりに囚われ肝心なこと後回しで考え過ぎていたよもっと自由になりたい響け　止めどなく溢れる流星のようにひたすらに不規則で　カッコ悪い僕の宇宙―ソラ―だけどどこにもないメロディーなら届けられるよ笑われてもいいから　全力で歌いたい
悦楽カメリア,http://j-lyric.net/artist/a0018f8/l018d2e.html,白い素肌に爪を立て震える嗚呼 痛みなんて 泡沫の夜の夢逃れられない 断ち切ろうとしてもあなたという 愛の亡者から狂おしく咲き乱れる華紅い紅い月冴ゆる待宵さえひそやかに悦楽を重ねるの無明の闇の中で貴方だけがすべてを支配する-抱く-の甘く導いて綺羅星のよう(強く強く)照らしている永久を願う夕轟きに疼き出す傷痕嗚呼 蘇るの 蜜のような旋律もう少しだけ この身に刻んでもう少しだけ 百合の花笑みを露の間に散りゆく言の葉人知れず印された証は ずっと心を掻きむしる 絶え間無く霧の帳の中で貴方だけがすべてを救うの そっと口づけて水影のよう(ゆらりゆらり)幻さえ麗しい光もっともっと奏でて私を壊す程に貴方に捧げましょう血のように燃えさかる謳を咲き誇る華紅い紅い月が待宵にたゆとう悦楽を重ねてく無明の闇の中で貴方だけがすべてを支配する-抱く-の甘く導いて綺羅星のよう(強く強く)照らしている永久を誓う
エデン,http://j-lyric.net/artist/a0018f8/l034655.html,それは、溶けてしまいそうな 淡い二人の囁き照らして、照らして…青い花長い沈黙掻き消すような光の粒が髪を伝うよどんな言葉も陳腐に見えて重なる指に答え求めたもう少し傍にいて時間よ止まって…愛する意味も知らずに愛されたいと願った勝手な想いが先走るやがて大人になって可笑しいと笑うんだろうか教えて、教えて 青い花息で曇った窓に描いた二人の夢が切なく浮かぶあの日まで戻れるなら何かが変わった…?声にならない気持ちが心の自由奪って悲しい記憶を繰り返すやがて大人になって忘れてしまうだろうか小さな、小さな 青い花我が儘で 眩しくて幸せは望むほど遠くに感じるけど二人だけの明日があると信じているだから…愛する意味も知らずに愛されたいと願った勝手な想いが先走るやがて大人になって可笑しいと笑うんだろうか教えて、教えて 青い花
王子様とあまいほし,http://j-lyric.net/artist/a0018f8/l003df4.html,やさしい ヒミツの においがとおくでしてるいつでも あいたいたいせつな おもいビトくるくる キラキラ ひかってわたしをよんでるどこからか あまいこえが聞こえてくるのはどうして?せかいじゅう だれより やさしいわたしの王子様あなたの そのえがお いつも わたしだけのたからものおおきな おそらに うかんでフワフワ ゆめみてるよそんなとき あまいこえが聞こえてくるのはどうして?せかいじゅう だれより やさしいわたしの王子様あなたの そのひとみ いつも わたしだけのたからものせかいじゅう だれより やさしいわたしの王子様あなたの そのえがお いつも わたしだけのたからものみんなみんな たからもの
想い,http://j-lyric.net/artist/a0018f8/l003dfd.html,キミを探してる キミのココロの中キミが見えなくて 空が遠く見えるこんなにそばにいて どんなに向き合っててもキミはすり抜ける だから不安になる余計不安になる痛いくらい抱いた想いはどれくらい届いてるの暗い暗い 星のない夜もいますぐ いますぐ キミの空へFly high Fly high…なんで気持ちには いつも形がないだからいますぐに 強い自分が欲しいキミに届くまでは痛いくらい感じた想いどれくらい叶ってくの痛いくらい こぼれる涙もいつかは いつかは光るようにFly high Fly high…永遠よりも 運命よりも今を止めてあふれている この想いをもっと伝えたい痛いくらい抱いた想いはどれくらい届いてくの暗い暗い 星のない夜もなんどでも なんどでも キミの空へFly high Fly high…
オルゴールとピアノと-holy style-,http://j-lyric.net/artist/a0018f8/l003df6.html,どれくらい空は遠くから見つめてるの?そこからはきっとあの場所を見えるのかな?人はいつでも何かにまよい答えをさがしてる ずっとずっとうそも上手に使えないまま愛の夢にはかない想いよせるかけがえのない…※小さなこの箱から流れてく I wish you 想い出のメロディ一秒でもふたりでいたいからBelieve your feelingdreams is satisfied冷たい雨はあがったから Oh yeah-※告白の橋も ケンカしたことも全部大切なもので いつまでもそばにいたい時に小さな思いちがいで描いた未来さえ背を向ける笑っていても泣きそうだけど きっといつか天気になると思う大好きだから…涙の深さよりも大切な I wish you 魔法の指先心に強い気持ちくれるからBelieve your feelingdreams is satisfied出会った場所に今帰ろう Oh yeah-(※くり返し)
おんなになあれ,http://j-lyric.net/artist/a0018f8/l00f44b.html,“おんなになあれ”鏡につぶやくあなただけに　似合いの女になれ信じてるけど　どこか切なくて今のままで　いいような　悪いような春の陽だまり　見つけた風が恋を連れ去る幻を見た早く閉じ込めて　あなたに子供のふりして　飛び込みたいのよあなたが私を　大人に運ぶのよ胸に隠したヒールの理由ちょっとだけ見ぬいてピンクの紅を　いつか赤にしてあなたの空　さすらうエトランゼいくつもの顔　身につけたならばあなたのこと　少しは迷わせたい春の陽ざしで　光を編んであなたの胸へ投げ込みましょう早く気づいてよ　わたしを子供のふりして　飛び込みたいのよあなたが私を　大人に運ぶのよ心を渡る季節の針　大人を指してる春をくぐって“おんなになあれ”あなたに似合う“おんなになあれ”“なあれ”子供のふりして　飛び込みたいのよあなたが私を　大人に運ぶのよ心を渡る季節の針　大人を指してる
奇跡のメロディア,http://j-lyric.net/artist/a0018f8/l02b28f.html,届けて…どうかこの気持ちだけ終わりの先の始まりへ…ねぇ覚えてる?あの蒼の色僕は今でも探しているんだ太陽のように包み込む笑顔身体中響く愛しい声すぐ傍にある未来に気付かずに崩れそうな幻想-あす-ばかり追いかけていたKISS＆CRY夢見るように歌ってもう一度空を踊る片翼の天使-ほし-君のその言葉だけが僕を導くよ何度だって奇跡を起こす 君と僕なら世界の果てへ飛んで行こうねぇ聞かせてほしい あの日の願い事君は静かに手を握りしめた月のように柔らかいまなざし心すべて溶かしてしまう指優しい過去に絡まった想い何も言わず受け止めてくれたねHOLD＆SMILE恋するように歌ってもう一度僕も知らない僕に出会えた君のその吐息さえも離したくないよやっと今、伝えられる『You are my future』約束して…どんな時だって胸に流れる旋律もう閉じ込めないでKISS＆CRYそして…夢見るように歌ってもう一度君のその言葉だけが僕を導くよ何度だって奇跡を起こす 君と僕なら世界の果てへ飛んで行こう
君よ叫べ,http://j-lyric.net/artist/a0018f8/l03db2a.html,時代の鬨(トキ)の声　高らかに響くよ可能性の限界解除して形式の海でbutterfly stroke―バタフライー理屈背負って　退屈育てるより地球に投げkiss 幸せ振りまこう最高の自分を愛してあげよう上手くいかなくても信じることを始めなきゃ　何も始まらない例え、高望みな妄想だって計り知れない明日に繋がっていくspiceになる誰にも縛られはしない心のあるがままに宇宙-そら-に想い馳せた夢追う詩人のように神話の1ページ読み解いて君との天地創造したい忘却が蝕む「平凡」な瞬間を「歴史」に変えるなら　本気を楽しもう手軽なvisionに真摯な情熱掻き乱されないで勇壮な微笑みを真実はいつでも胸の中に無情の現実を突き付けられても揺るがず輝きを放つよ思いきり僕等の愛を叫ぼう数え切れない未来　振り向かせよう覚悟はいいかい？誰にも止められはしない未だ見ぬ新開の地へ
禁断のレジスタンス,http://j-lyric.net/artist/a0018f8/l033340.html,始まりは理不尽な程愛おしく終わりへと抗う姿試してる...?何の為に産まれ生きていくのかもがくだけじゃ何も手に出来ない運命のlogicに踊らされた虚夢の楽園そこに、意味はあるのか?この儚くも美しい絶望の世界で砕け散った希望は 行き場を求めて紅に染まる記憶に 涙など忘れて高らかに捧げよう 永遠への歌をI wanna fly! (high!)Fly!(High!)生温い時間なんて切り捨てYou feel the beat!(down!) Beat!(Down!)響かせ饒舌に空を舞うのも悪くない果てしなく深く広がる海のように壊れても輝き放つ星のように絶え間なく押し寄せる孤独の闇も悠然と抱き締め続けたい瞳に映ってる その幸せは誰のモノなの...?いま、真実を越えて...朽ち果てた未来見つめ 戦き叫んで消せない過去嘆いて 立ち止まるよりも呆れるほど信じ抜いて無様に笑いたい潔く飛び立とう 明日が待ってる同じ朝は二度と訪れない不揃いの想いが起こす奇跡譲れない願いがあるならすべてさらけ出して どこまでも行こうよそして...儚くも美しい絶望の世界で砕け散った希望は 新たな決意へ紅に染まる記憶に 涙など忘れて高らかに捧げよう 永遠への歌をI wanna fly! (high!)Fly!(High!)生温い時間なんて切り捨てYou feel the beat!(down!) Beat!(Down!)響かせ饒舌に空を舞うのも悪くない
禁断のレジスタンス -Extended Mix-,http://j-lyric.net/artist/a0018f8/l0384bb.html,この儚くも美しい絶望の世界で高らかに捧げよう　永遠への歌を始まりは理不尽な程愛おしく終わりへと抗う姿試してる…？何の為に産まれ生きていくのかもがくだけじゃ何も手に出来ない運命のlogicに踊らされた虚夢の楽園そこに、意味はあるのか？この儚くも美しい絶望の世界で砕け散った希望は　行き場を求めて紅に染まる記憶に　涙など忘れて高らかに捧げよう　永遠への歌をI wanna fly！ (high！) Fly！ (High！)生温い時間なんて切り捨てYou feel the beat！ (down！) Beat！ (Down！) 響かせ饒舌に空を舞うのも悪くない果てしなく深く広がる海のように壊れても輝き放つ星のように絶え間なく押し寄せる孤独の闇も悠然と抱き締め続けたい瞳に映ってる　その幸せは誰のモノなの…？いま、真実を越えて…朽ち果てた未来見つめ　戦き叫んで消せない過去嘆いて　立ち止まるよりも呆れるほど信じ抜いて無様に笑いたい潔く飛び立とう　明日が待ってる同じ朝は二度と訪れない不揃いの想いが起こす奇跡譲れない願いがあるならすべてさらけ出して　どこまでも行こうよそして…儚くも美しい絶望の世界で砕け散った希望は　新たな決意へ紅に染まる記憶に　涙など忘れて高らかに捧げよう　永遠への歌をI wanna fly！ (high！) Fly！ (High！)生温い時間なんて切り捨てYou feel the beat！ (down！) Beat！ (Down!) 響かせ饒舌に空を舞うのも悪くない
コイウタ。,http://j-lyric.net/artist/a0018f8/l0384bc.html,午前2時　眠れずに溜め息をついた君の言葉を待ってるディスプレイを見つめたまま今のふたり、「いい友達」の距離を壊したくないけどいつからだろう？君に会うたび　心が揺れて…好きだよ　好きだよ　降り積もっていく愛しさこんな戸惑い　私だけかな？きっと、もう戻れない触れそうで届かないもどかしい気持ち　それさえやさしく灯る光のようにそっと心　包んでる頼りない赤い糸　たぐりよせるにはもう少しだけ、勇気が足りなくって躊躇ってるでもこれ以上　君へ向かう気持ちを抑えきれそうにないだって、君がそう　無邪気に微笑うだけで幸せ「泣けちゃうくらいに　君しか見えない」誰より特別な人君に出逢えた奇跡かみしめている好きだよ　好きだよ　降り積もっていく愛しさそのぬくもりにねえ、触れたいよだから君に　伝えよう
恋してる…,http://j-lyric.net/artist/a0018f8/l00a366.html,目が覚めて一番に いつからか?わたしも焼きたてのトーストと あなたが好きなミルクティー鏡の中には オレンジ色のほほあなたのせいじゃないいと うつむくのわたし恋してる 昔見たあの映画の夢見る乙女のような 胸の鼓動わたし信じてる これが「幸せのかたち」もう おくびょうな自分にさようなら通り雨 アスファルト 濡らして去って行く水たまり映るのは 昨日とは違うワタシなのやさしいメロディー 忘れかけていた子供の頃の記憶 呼び覚ますわたし恋してる 星がまたたく昨夜も想いがふくらみ まるでドラマのようあなたの笑顔 それは「幸せのあかし」本当の恋を知った 秋の午後あの頃のように 冷たい涙が心くもらせること もうないいよわたし恋してる 星がまたたく昨夜も想いがふくらみ まるでドラマのようあなたの笑顔 それは「幸せのあかし」本当の恋を知った 秋の午後わたし恋してる 星がきらめく今夜もあなたの事考えて 眠れないよあふれる笑顔 これも「幸せのあかし」
