Level Hi!,http://j-lyric.net/artist/a0018f8/l00a35b.html,いつのまにか青空 びしょ濡れの昨日が消えていくヒソヒソ誰のウワサリセットしたらほらね 全部片付けられる私はこれから一人走り出す準備ができてるわ私らしく生きようと そう決めたあの日からレベルアップしてるだからどうか邪魔しないでお返しにあなたには 踊れるナンバーを差し上げるわ負けない夢を抱きしめてAh どんなときも必ず春はやって来るから走り出した電車も 行けない場所があるの知ってるよ私だけのスタイルモノクロだった世界が もっとカラフルになるキセキじゃなくヒツゼンを巻き起こして見せてあげるから私らしくいてイイと そう思えたらきっとドコへだって行ける風に背中を押されて加速するハートが 自力のスピードでゴールするわ遠くに見えた目的地Ah 待っていてね もうすぐ春を迎えにいくよ私らしく生きようと そう決めたあの日からレベルアップしてるだからどうか邪魔しないでお返しに私から 踊れるナンバーを差し上げるわ負けない夢が輝いて Ah心からのヨロコビ実らせてみせるから
LINKAGE,http://j-lyric.net/artist/a0018f8/l02b28d.html,痛み消える前に またできた傷痕戦う証 なぞって目をとじる断ち切りたい運命 そして君はどこへ過去と未来 モンタージュ ゆがんで消えたどうすればいい そんな思いが かけめぐって また戻って剣をかまえる時 願いはカタチを変えない出逢いが呼び起こすpleasure lives一秒の決意を今 震える唇が叫ぶ「共に生きてほしい」いつか離れてしまう手なら キズナをつなぎつづけたい一生に一度だけ 同じ空で 共に生きようall for win 遠回りしてもall for wish 途方にくれてもこうしてここまで たどり着いたから君が望む世界 僕が臨む覚悟交わる時に 響かせようevangile背中合わせだった 鼓動聞こえていた心針を合わすように やさしく触れてもう迷わない 大事なひとの 大切なもの 守るためにこの身をささげる時 願いは姿をあらわす女神は僕たちを見てる 光の日も闇の夜も一人で立ち上がれるなら 誰かを救えるいつか離れてしまう手でも キズナを信じつづけたい出逢ったのは必然 同じ空へ くちづけしよう愛と呼ぶにはあまりに 短い言葉だとしてもはじめて見せた笑顔僕は君を あの日選んだきっときっと超えていくティターンgo away出逢いが呼び起こすpleasure lives一秒の決意を今 震える唇が叫ぶ「共に生きてほしい」いつか離れてしまう手なら キズナをつなぎつづけたい一生に一度だけ 同じ空で 共に生きようall for win 遠回りしてもall for wish 途方にくれてもこうして君まで たどり着いたから必ず叶える キズナはpleasure lives
Look Away,http://j-lyric.net/artist/a0018f8/l00f46a.html,スキと言いかけたままゴメンねと胸がつぶやくあなたの知らない人少しひかれてたよそみをするのはナゼ不満なんて全然ないのにわたしの中にもきっと悪魔は住んでる抱いていて　体ごと体温で感じたいその瞳　映ってるMy Loveそれだけでいいよ昔の話はしないあなたの優しさなのかなふたりの想い出もっと増やしていきたい抱いていて　心まであなただけ見ていたい青空に　映ってるMy Love輝かせて行こうわがままだって　きっと素直にだって　きっとあなたがいるからできる抱きしめる　あなただけ今のまま　今以上あなただけ　映したいMy Heartそれだけでいいのよそみさせないで
LOOKING ON THE MOON,http://j-lyric.net/artist/a0018f8/l00f46b.html,Now looking on the moonLet's heal a heart…なんか最近　浮かない気分　ha～ah～満員電車　駅まであと5分雨はまだ降ってるかな背中の波のすきまちょっと見えてる窓の外にお月様Looking on the moonめげてるときには夜空を見上げてみようよ月のうさぎ　笑って優しい気持ちくれるよつらいことは　避けて通りたいけど攻略しなきゃ　clearできないコンビニによってみよう結構　気分転換あのデザートまだ売ってるかな　限定かなLooking on the moon泣きたいときには夜空を見上げて雫そう月のあかり　静かに包み込んでくれるよLooking on the moon背筋をのばして夜空を見上げて行こうよ元気になって帰ろう明日はきっと　晴れるよ…
LOVE & HISTORY,http://j-lyric.net/artist/a0018f8/l003def.html,※Faraway. Faraway. この想いをFaraway. Faraway. 胸に秘めて遠く遠くきみのもとへ愛の歴史刻みたい With you…※忘れようとした過去にしようとしたどんな思い出も褪せていくものだと…だけどきみの声が胸に響いたまま大切な人と気づきすぎるだけ(…anatagasukinano…)Zutto Zutto 想っていたZutto Zutto 忘れなかったきみをきみを見つめていた苦しいほど恋しくて My love…どんな歴史でも涙は流れてるどんな絆でも切れそうになるものだから ためらわないで夢の続きだけをもういちど胸で信じて生きたいFaraway. Faraway. この想いをFaraway. Faraway. 伝えたいよいつもいつもきみのそばで愛の歴史つくりたい With you…もし未来でふたりがつながってるとしたら別々のこの日々もふたりの歴史になる I believe…Zutto Zutto 想っていたZutto Zutto 忘れなかったきみをきみを見つめていた苦しいほど恋しくて(※くり返し)
Love Brick,http://j-lyric.net/artist/a0018f8/l027602.html,きらめく アイラインの境界線を今日も飛び越え君に逢いに行くんだ完璧すぎる偶然をメイクアップして強がりの裏側 仕掛けられたトラップは 難解だけど 気付いて?君だけにしか 反応しない スイッチがあるみたい..baby i love youbaby in your eyesi'm in wonderland君の前だと 自分がまるで 自分じゃないのだけど 誰より あたしなのi might love you nowi might hate you now曖昧 wonderlandわからなくなる君のことしか もぅ 見えない 新しい世界で君と過ごす時間が特別なまま あたりまえになるちょっと うれしくなって よくばっちゃうよ?ねぇ まだ 帰りたくないいじわるで やさしい 君を もっと 知りたいずっと 前から 決まってた 運命だとか 永遠だとか 信じそうになってる..baby i love youbaby in your eyesi'm in wonderlandやっと 見つけた 君の隣で 解き明かしてくまだ 誰も 知らない アタシi might love you nowi might hate you now曖昧 wonderland矛盾だらけだ君のことしか もぅ 見えない 新しい世界で加速してく tic☆tac胸を刻む ときめきを追いかけて ここまできた止まらないよ グロスティック君に 恋に 堕ちて行く本当と嘘が ひとつにとけてしまった心でbaby i love youbaby in your eyesi'm in wonderland君の前だと 自分がまるで自分じゃないのだけど 誰より あたしなのi might love you nowi might hate you now曖昧 wonderlandわからなくなる君のことしか もぅ 見えない 新しい世界で 真実の世界で
Love Trippin',http://j-lyric.net/artist/a0018f8/l00e9a9.html,旅に出るよ君と　ポケットにはキャンディありったけの夢を　花束にして聞き慣れた口グセ　アナウンスにしてさカカト響かせ　お得意なステップ!この世界を　書き換える為の絵の具ならいつでも持ち合わせてる話そうよ　素敵な物語を金色の森を架ける　虹みたいに太陽に合図を送る　そう、どこにもない君だけの暗号　もっと僕に聞かせて月が歌い出して　星たちを連れてくありふれてる景色も　たまにいいよね？歩き疲れたなら　僕が手をひくからキャラメルのように　優しい声　伝えてカラフルなボトルに詰めた　甘いフルーツはいつでも胸にあるから話そうよ　僕らの物語を夜よりも永く深い　ロマンチシズム好きなだけ描くよ　それは　消えることない二人が見つけた　映像になるだろう曖昧なコトバを並べるよりダイレクト!　感じたい話そうよ　素敵な物語を金色の森を架ける　虹みたいに太陽に合図をしたら　ほら、続いてく僕たちの暗号　ずっと刻んでいこう
Love's Wonderland,http://j-lyric.net/artist/a0018f8/l00f45f.html,※Merry go round　めくるめく世界で最高のLOVEをしようWonderland　あふれだす想いを届けましょう※戸惑うNews　ときめくMail　街に飛びかって混み合う道路　未来のRoad　混線は続いてくどんな毎日も　楽しみかくしてる宝探しだね　もっと検索してみよう(※くり返し)涙のモード　笑顔のモード　繰り返しながら愛の花は　夢のドアは　いつか開いてくChanceなんてもの　突然やってくるめげるひまはない　もっと期待をして行こう△Merry go round　めぐり逢う誰かと最高のLOVEをしようWonderland　とまらない想いを叶えましょう△(※くり返し)(△くり返し)
Lovely Fruit,http://j-lyric.net/artist/a0018f8/l02b2dc.html,いただきますLovely Fruitらしくないワンピース着て　背伸びしたヒールの靴でアンニュイな振りをして　デートの作戦は100パーOKあなたの素顔のすべて　スクープしてみたいのAll days恋とは呼びたくない　なんか負けた気がする飛び越えたいJump　これはたぶんChance　たわわに実ってLovely×2口元へとPyun　お運びしまSu!　言うこと聞いて食べましょうね☆あなたのハートのまるごとゼンブ　いただきますDarlin'×2あなたのお膝の上でならAh　素直になっていいかもね世界中で一番の「大好き」あげてもいいよいただきますLovely Fruit月より輝くのはね　あなたが太陽だからよ1秒でも笑顔でキラキラしていたいの乙女ってのはStar　何千年もFlash　エメラルドみたいKiralin'×2そこんとこをKnow　わかってますKa?　愛の歴史なめないで☆心をぎゅっとしてくれたらね　目を瞑るよDarlin'×2勇気のタイミングくらいはほら　そちらのお仕事でしょ?でもねやっぱ恥ずかしいからForgive meおあずけです　よい子は早くSleeping慣れないけどTry　想いを今Catch　夢にでるくらいLonely×2寂しくないよ　強いんだから　ヤじゃないってことでAll right?「…But I love you」あなたのハートの熱い果実を　いただけます?Darlin'×2春夏秋冬永遠一生　手を繋がせてあげるあなたのハートのまるごとゼンブ　いただきますDarlin'×2あなたのお膝の上でならAh　素直になっていいかもね世界中で一番の「大好き」あげてもいいよ食べてもいいよいただきますLovely Fruit
MARIA&JOKER,http://j-lyric.net/artist/a0018f8/l018d2a.html,"ワンコイン渦巻くChance...赤か黒かOne more chance...Kissの尊厳もレイズ...もう後戻り出来ない?Ah熱情Bloody 欲しかった君色ハート撃鉄に 震えたTwo-hand伝えたい弾丸『Love you』恋を撃ち墜とせ どんな手でもいいOh god...罪にお許しを...そうJoker was knowing マリアの素顔ピストルに愛を込めたなら君の名の下嘘を放とう...二人のワタシWhich did you like?レッスンしてMr...上手に出来ないの....甘い小悪魔Rip...ピエロは笑ってKillingAh星はTasting エデンの苺のよう御心は 銃と共にTriggerの遁走曲『So Cry』新世界でまた 出会いましょうねMy dear...ホント好きだった3秒後には 飛ばせてアゲル原初の日 愛は歌だったねぇせめて最後は子守唄で...お眠りなさい...今宵ハ間モナク閉ザサレユク...記憶...追憶...遠クへ...天使達の501で射抜かれ君はまた生まれ空を見る...Oh...God...天に召されよGuy 聖なる夜にOh god... Which am I? Angel or devil?そうJoker was myself マリアは仮面嘆くほど 愛が狂わせたもう一度□づけ願うならば神に頼んで 銀河を変えてまたルーレットしましょうLet's begin ""LIVE""..."
MASSIVE WONDERS,http://j-lyric.net/artist/a0018f8/l00b25d.html,誰でもなく君の為にできること僕は想う 僕は願う まっすぐに不確かで固めた 自分的規則―ルール―にすがっていたよ言い訳で飾られた過去攻略―クリア―したい天上の宝石(ほし) 朱く染める奇跡の種(つぶ) 拾い集めてまだ見えぬ未来―よる―の先に伝えたいよ 想像―まぼろし―を破り情熱的な言葉はなくても今、ここにいること それが僕の答え―真実―愛しいもの 大事なもの 増えるたび心の中 カギをかけて閉じ込めた温もりを手にすることに慣れてなかったいつかくる｢もしも｣に恐れ動けずいた宵闇の月 僕を誘う惑いのveil消し去っていく隠してた ズルい影―自分―弱さも全部受け止めた時に初めて感じた｢守りたいもの｣はいつもそこに…何も言わず ただ抱きしめる朝未き空 君を想う素直な声 届けられたら隠してた ズルい影―自分―弱さも全部 力に変えて宇宙(てん)の宝石(ほし) 朱く染める奇跡の種(つぶ) 拾い集めてまだ見えぬ未来―よる―の先に伝えに行く想像―まぼろし―を破り情熱的な言葉はいらない今、ここにいること それが僕の答え―真実―
METRO BAROQUE,http://j-lyric.net/artist/a0018f8/l028f91.html,私を呼ぶのは誰…?粋狂に踊る熱に浮かされたこの世界で宝石のような嘘 身に付け誘う甘く淫らな眼差しが絡み付くアラガエナイ…運命の欠片繋ぎ合わせ疼く本能深紅の月暈が照らし出す真実に脆く崩れ去る虚言―ユメ―を闇へと突き立てる教えて…永遠のその先があるなら何もいらない道標は貴方だけ貴方を呼ぶのは誰…?姿のない罪に囚われてさ迷う独り瞬きも出来ないほど注がれる愛に戸惑いながら溺れてしまいそうココニイルヨ…凍てついた時を溶かす それは、囁きの回廊舞い散る銀の花 幽黙に美しく咽ぶ声なき声が心を掻き毟る答えて…壊れない情実があるなら夜を飛び越え 今、会いに行く眩い願いは そう…いつも閉じ込めて満たされぬ隙間傷付け埋める果てのない光に焦がれてた不安がまた安らぎ求め 先回り繰り返す深紅に染まる月 哀しみを切り裂いて脆く崩れ去る幻―ユメ―は決意に変わる教えて…永遠のその先があるなら何もいらない道標は貴方だけ 嗚呼…
Million Ways=One Destination,http://j-lyric.net/artist/a0018f8/l03117c.html,生きていくことは 汚(ケガ)れていくこと?諦めという名の言霊 今日も襲い来る風の隙間から また声が聞こえる「なんのため?」「誰のため?」…耳を塞ぐあの日の答えが 霧で霞むけど手探りで わかる行き先は 一つ逃げたくない 強い衝動ベルを鳴らす Fatal Signal乖離する 理性と 感情槍のように降る雨を睨み付け 今を切り裂いていくまだ見えない 光 信じて全て時の中 ほころび すさんでく目を閉じて また溶けていく 甘い悪夢へと紡ぎあげてきた 細く長い糸は真実を 幻想に 縛り付ける怒りは痛みを 絶望は憎しみを堕ちていく 連鎖を断ち切れる この手であやふやな 現実もぼやかした 未来地図も闇を深めるなら 要らない失った時 初めて生まれ来る 赤い炎は熱を帯び 青へと変わる矛盾の中で もがきながらも創り上げていく 運命I believe million lightsMillion ways but we're gonna reach one destination.Million days but we're gonna achieve one precious time.Million ways but we're gonna reach one destination.Million days but we're gonna achieve one precious time.逃げたくない 強い衝動ベルを鳴らす Fatal Signal乖離する 理性と 感情槍のように降る雨を睨み付け 今を切り裂いていくまだ見えない 光 信じて
Mr.Bunny!,http://j-lyric.net/artist/a0018f8/l018d2b.html,so everydayseverylife君を想う これからもずっとねどんな時だって君がくれた笑顔は色褪せず輝いて僕の胸にそう 変わらないままでスクランブルの交差点向こうから見送る君の手に目を反らして素っ気ないふりをしたね華やぐ街のショーウィンドー照れながら後ろを歩いてた君の面影消えないままあの頃とは違った景色でもほら上手に笑って青い空見上げなんとか踏み出してみるよso everydayseverysmile君が僕に教えてくれたこと失くした時にはじめて大切さが解るって本当だね僕一人で上手く笑えるのかな二人だけの記念日には嬉しそうにはしゃいだ君のその姿が可愛いと言い出せずに今ならわかる怒った時見せる強がり言う癖 わがままな態度全て愛しいと思うのにso manythingsmanytime｢君以上に分かち合える誰かを見つけてやるさ｣なんて強がって言ってみたけれどねそうじゃない君以上の誰かなんていないさso everydayseverylife君を想う これからもずっとねどんな時だって君がくれた笑顔は色褪せず輝いて僕の胸にそう 変わらないままで
M・A・M・A,http://j-lyric.net/artist/a0018f8/l00a6d3.html,毎日同じ家路を たった一人で歩いてる後ろを見たらあの頃が 遠くに消えてしまう久しぶりの日曜日 街は雨で濡れている電話をしたら瞳にも 雨が降りだしたよ私の住む 都会の空に星が一つ 光って微笑んだ素直に「ごめんね」って言う事が出来なくて 苦しむ小さな肩を麗しい その手でぎゅっと抱いてそれだけで私の 心は やさしくなれる見守っていてね My Mother晴れた日には願ってるの あなたの住む街並が大きな太陽射しこんで どうか賑わうように季節もまだ 都会の街は変わらないの 今夜も寒そうで笑顔で 見送ってくれたあなた一人なら ここには来れなかったはず偉大な あなたがあの日胸で教えてくれた事 大事に 羽ばたかせよう支えていてね My Mother素直に「ごめんね」って言う事が出来たから 景色が変わってきたのこれから 先の見えない道もほら見えてきたのは 背中を 押してくれてるあなたのお陰 My Mother
NAKED FEELS,http://j-lyric.net/artist/a0018f8/l00f466.html,心に触れた記憶を集めて夜明けの来ない海へ流したいよ何度も言葉　探してみたけどいつも　願いは星になって君が咲かせたキレイな花は今でも静かに揺れて　涙をこらえ　叫んでる※どんな時も　強く抱きしめたいよ一番近くで見つめて欲しいからI wish you love me forever胸に響いてるかな?　新しい朝トキメク未来たちを感じたいDo you feel my heart?※ここから救い出して欲しいケド踏み出す力が　まだ足りないんだ降り続いてる雨が上がったらボクのココロに虹がかかる?時間のループ途切れて欲しい想いと届けられない言葉が二つに重なる溢れ出した　愛を映していくよいつも君の手で照らして欲しいからI wish you love me forever自分だけのツバサで　きっとやさしい場所まで飛び立てると信じたいDo you feel my heart?切ない胸の痛みはそっと満ちてく温度に変わってく(※くり返し)
Naked Soldier,http://j-lyric.net/artist/a0018f8/l02b28b.html,星が空へ散らばる時は心うずく満月夜風が街へ彷徨う時は一人孤独噛み締めるよ運命なんてこの瞳閉じれば過去も今もその未来も一つNaked soldier どうかこの世界だけ全てを懸けて守りたいよこの声が少しでも届くなら足を止めて明日へ向かう闇を消す光誰もが皆寄り添う度に少し安堵分かち合うよ現実だって受け入れる勇気で共に歩む道がきっと見えるNaked soldier どうかこの世界だけ命を賭して守り抜くよこの声が少しでも届くなら目を覚まして夢の途中差し込むの光ねぇ君は感じるこの蒼い鼓動を I feel so moreねぇ君は聞こえるこの僕の囁き I feel so heartNaked soldier どうかこの世界だけ全てを懸けて守りたいよこの声が少しでも届くなら足を止めて明日へ向かう闇を消す光夢の途中差し込むの光明日へ向かう闇を消す光
NANA色のように ～Special album version～,http://j-lyric.net/artist/a0018f8/l00f45e.html,※NANA色のように透き通る雫この手に今NANA色の空へ希望のかけらを集めて　光解き放つ※始まりはいつも　偶然が導いて響き出すこの歌が　今ふたりをつないだこうしてあなたへ　少しだけの勇気と少しだけの笑顔を　そっと贈れたなら果てない未来　この空超えて　永遠に続くかけがえない　あなたの声　ほらこの瞬間を染めて(※くり返し)涙の向こうに　深く眠る太陽命を吹き込んだら　輝き取り戻すつまづくことを　怖がらないで　やがて訪れる明日へ続くドアを開けて　ほら二人歩き出そう(※くり返し)終わりのない夢の続きへ踏み出そう勇気出して…NANA色のようにすべてを笑顔の魔法で今NANA色の願い叶えてあげたい　あなたへ届くように…(※くり返し)
Necessary,http://j-lyric.net/artist/a0018f8/l034653.html,広がる空から光が零れてふたつのてのひらを翼に変える静かに流れる時間を繋いではじまりが続く夢になればいいありふれたことくりかえすだけでも胸はまた熱くなるの止めておけないいまがなぜあるのか教えて愛にふれて抱きしめるためにめぐり逢う誰かがいる大切なものが心には確かに見えるたった一度たったひとりその意味に応えながら幸せがわかるただあなたといたいなにかを失い覚えた涙に弱さを知るほどまだ強くなれる変わってしまう季節の中にある決して変わらない記憶その微笑みを守れる優しさを知りたい愛にふれて抱きしめるためにめぐり逢う誰かがいるさみしさも癒やすあたたかい声が聴こえるきっと一度ずっとふたりその意味を信じながら幸せになれるただあなたといたい消えていかないいまがなぜあるのか教えて愛にふれて手を伸ばすだけでぬくもりは伝えあえる抱きしめるためにめぐり逢う誰かがいる大切なものが心には確かに見えるたった一度たったひとりその意味に応えながら幸せがわかるただあなたといたい広がる空から光が零れて
Never Let Go,http://j-lyric.net/artist/a0018f8/l0384bf.html,豪雨の闇息を止め　彷徨う夜明け閉じこもればどこも世界はclever誰かが引く境界線また従うだけ思うことの半分も言えないまま無抵抗いま逆光を貫くようにもう言い訳に逃げるないま逆風も振り切るように心を解き放って孤独さえ　握りしめNever let go Never let go鎮まらない　胸の音ほんとうなら　絶対Never let it go迷路の果て真実はrealと違うfakeばかり愛に似ているdesire正しくてもminority追い込まれるだけ沈黙では　終われない夢まで　なぜ　蜃気楼いま断崖に立ち尽くそうともう魂を離すないま幻想にひれ伏すような涙を拭い去って悲しみに打たれてもNever let go Never let go裏切れない　胸の音ほんとうなら　絶対Never let it goかならずある臨界点ただ信じるだけ傷を負って嘆くより怖れるのは無反応いま逆光を貫くようにもう言い訳に逃げるないま逆風も振り切るように心を解き放って孤独さえ　握りしめNever let go Never let go鎮まらない　胸の音ほんとうなら　絶対Never let it goNever let it goJust Never let it go
